[
  {
    "subject": "county:39057",
    "subject_label": "Greene County, Ohio",
    "subject_kind": "county",
    "predicate": "establishments",
    "value": 4113.0,
    "unit": "establishments",
    "status": "verified",
    "approximate": false,
    "low": null,
    "high": null,
    "evidence": {
      "source": null,
      "source_kind": "connector",
      "page": null,
      "citation": "BLS QCEW 2023 annual averages, area 39057",
      "confidence": "high",
      "asof": null,
      "verified": true
    },
    "feed": "economics-baseline"
  },
  {
    "subject": "county:39057",
    "subject_label": "Greene County, Ohio",
    "subject_kind": "county",
    "predicate": "total_employment",
    "value": 78410.0,
    "unit": "jobs",
    "status": "verified",
    "approximate": false,
    "low": null,
    "high": null,
    "evidence": {
      "source": null,
      "source_kind": "connector",
      "page": null,
      "citation": "BLS QCEW 2023 annual averages, area 39057",
      "confidence": "high",
      "asof": null,
      "verified": true
    },
    "feed": "economics-baseline"
  },
  {
    "subject": "platform:bosc",
    "subject_label": "Watermark / BOSC platform",
    "subject_kind": "platform",
    "predicate": "ai_inferences",
    "value": 1395.0,
    "unit": "calls",
    "status": "inference",
    "approximate": false,
    "low": null,
    "high": null,
    "evidence": {
      "source": null,
      "source_kind": "derived",
      "page": null,
      "citation": "Anthropic total tokens (5,580,000) ÷ 4000 avg tokens/call (the Admin API exposes no per-message count)",
      "confidence": "low",
      "asof": null,
      "verified": false
    },
    "feed": "greenops"
  },
  {
    "subject": "platform:bosc",
    "subject_label": "Watermark / BOSC platform",
    "subject_kind": "platform",
    "predicate": "carbon",
    "value": 0.0149,
    "unit": "MTCO2e",
    "status": "inference",
    "approximate": false,
    "low": 0.00428,
    "high": 0.03656,
    "evidence": {
      "source": null,
      "source_kind": "derived",
      "page": null,
      "citation": "electricity x eGRID subregion CO2e output rate, apportioned by fleet: SRVC 596.326 lb/MWh (100% of vCPU-hrs); inference at SRVC (the model provider does not disclose a serving region, so inference energy is attributed to the primary subregion)",
      "confidence": "low",
      "asof": null,
      "verified": false
    },
    "feed": "greenops"
  },
  {
    "subject": "platform:bosc",
    "subject_label": "Watermark / BOSC platform",
    "subject_kind": "platform",
    "predicate": "carbon_derived_location_based",
    "value": 0.0149,
    "unit": "MTCO2e",
    "status": "inference",
    "approximate": false,
    "low": 0.00428,
    "high": 0.03656,
    "evidence": {
      "source": null,
      "source_kind": "derived",
      "page": null,
      "citation": "electricity x eGRID subregion CO2e output rate, apportioned by fleet: SRVC 596.326 lb/MWh (100% of vCPU-hrs); inference at SRVC (the model provider does not disclose a serving region, so inference energy is attributed to the primary subregion)",
      "confidence": "low",
      "asof": null,
      "verified": false
    },
    "feed": "greenops"
  },
  {
    "subject": "platform:bosc",
    "subject_label": "Watermark / BOSC platform",
    "subject_kind": "platform",
    "predicate": "carbon_market_based",
    "value": 0.018,
    "unit": "MTCO2e",
    "status": "reference",
    "approximate": false,
    "low": null,
    "high": null,
    "evidence": {
      "source": null,
      "source_kind": "reference",
      "page": null,
      "citation": "AWS Sustainability GetEstimatedCarbonEmissions (Jul 2025-Jun 2026)",
      "confidence": "high",
      "asof": null,
      "verified": false
    },
    "feed": "greenops"
  },
  {
    "subject": "platform:bosc",
    "subject_label": "Watermark / BOSC platform",
    "subject_kind": "platform",
    "predicate": "carbon_provider_location_based",
    "value": 0.045,
    "unit": "MTCO2e",
    "status": "reference",
    "approximate": false,
    "low": null,
    "high": null,
    "evidence": {
      "source": null,
      "source_kind": "reference",
      "page": null,
      "citation": "AWS Sustainability GetEstimatedCarbonEmissions (Jul 2025-Jun 2026)",
      "confidence": "high",
      "asof": null,
      "verified": false
    },
    "feed": "greenops"
  },
  {
    "subject": "platform:bosc",
    "subject_label": "Watermark / BOSC platform",
    "subject_kind": "platform",
    "predicate": "compute",
    "value": 6366.0,
    "unit": "vCPU-hrs",
    "status": "inference",
    "approximate": false,
    "low": null,
    "high": null,
    "evidence": {
      "source": null,
      "source_kind": "derived",
      "page": null,
      "citation": "AWS billed instance-hours x vCPU/instance + GitHub Actions minutes x runner cores",
      "confidence": "medium",
      "asof": null,
      "verified": false
    },
    "feed": "greenops"
  },
  {
    "subject": "platform:bosc",
    "subject_label": "Watermark / BOSC platform",
    "subject_kind": "platform",
    "predicate": "electricity",
    "value": 0.0551,
    "unit": "MWh",
    "status": "inference",
    "approximate": false,
    "low": 0.0158,
    "high": 0.1352,
    "evidence": {
      "source": null,
      "source_kind": "derived",
      "page": null,
      "citation": "6366 vCPU-hrs x 7 W/vCPU x PUE 1.2 (infrastructure) + model inference energy; band from the coefficient ranges",
      "confidence": "low",
      "asof": null,
      "verified": false
    },
    "feed": "greenops"
  },
  {
    "subject": "platform:bosc",
    "subject_label": "Watermark / BOSC platform",
    "subject_kind": "platform",
    "predicate": "electricity_inference",
    "value": 0.0016,
    "unit": "MWh",
    "status": "inference",
    "approximate": false,
    "low": 0.0006,
    "high": 0.016,
    "evidence": {
      "source": null,
      "source_kind": "derived",
      "page": null,
      "citation": "Anthropic output tokens x per-model-class Wh/1k output tokens (Epoch AI 2025-02 / Jegham et al. 2025-05 / Google 2025-08) x PUE 1.2 — the published coefficients are accelerator+host, so facility overhead is added here — claude-sonnet-4-6 (950,000 output tokens) at the mid_tier coefficient 0.6 Wh/1k [0.3-6]; claude-opus-4-8 (380,000 output tokens) at the frontier coefficient 2 Wh/1k [0.6-12]",
      "confidence": "low",
      "asof": null,
      "verified": false
    },
    "feed": "greenops"
  },
  {
    "subject": "platform:bosc",
    "subject_label": "Watermark / BOSC platform",
    "subject_kind": "platform",
    "predicate": "electricity_infrastructure",
    "value": 0.0535,
    "unit": "MWh",
    "status": "inference",
    "approximate": false,
    "low": 0.0152,
    "high": 0.1192,
    "evidence": {
      "source": null,
      "source_kind": "derived",
      "page": null,
      "citation": "6366 vCPU-hrs x 7 W/vCPU x PUE 1.2 (instances + CI runners)",
      "confidence": "low",
      "asof": null,
      "verified": false
    },
    "feed": "greenops"
  },
  {
    "subject": "platform:bosc",
    "subject_label": "Watermark / BOSC platform",
    "subject_kind": "platform",
    "predicate": "grid_carbon_intensity",
    "value": 596.326,
    "unit": "lb CO2e/MWh",
    "status": "reference",
    "approximate": false,
    "low": null,
    "high": null,
    "evidence": {
      "source": null,
      "source_kind": "reference",
      "page": null,
      "citation": "EPA eGRID2023 subregion file (SRL sheet)",
      "confidence": "high",
      "asof": null,
      "verified": false
    },
    "feed": "greenops"
  },
  {
    "subject": "platform:bosc",
    "subject_label": "Watermark / BOSC platform",
    "subject_kind": "platform",
    "predicate": "water",
    "value": 29.1,
    "unit": "gal",
    "status": "inference",
    "approximate": false,
    "low": 3.7,
    "high": 115.7,
    "evidence": {
      "source": null,
      "source_kind": "derived",
      "page": null,
      "citation": "tenant-attributed provider facility cooling (site WUE x IT-kWh) + the upstream generation increment (x facility kWh) — a source-basis total, not two bases summed",
      "confidence": "low",
      "asof": null,
      "verified": false
    },
    "feed": "greenops"
  },
  {
    "subject": "platform:bosc",
    "subject_label": "Watermark / BOSC platform",
    "subject_kind": "platform",
    "predicate": "water_budget_cap",
    "value": 150.0,
    "unit": "gal",
    "status": "inference",
    "approximate": false,
    "low": null,
    "high": null,
    "evidence": {
      "source": null,
      "source_kind": "assumption",
      "page": null,
      "citation": "stated internal annual water-draw budget (a target, not metered)",
      "confidence": "low",
      "asof": null,
      "verified": false
    },
    "feed": "greenops"
  },
  {
    "subject": "platform:bosc",
    "subject_label": "Watermark / BOSC platform",
    "subject_kind": "platform",
    "predicate": "water_direct",
    "value": 1.5,
    "unit": "gal",
    "status": "inference",
    "approximate": false,
    "low": 0.4,
    "high": 25.0,
    "evidence": {
      "source": null,
      "source_kind": "derived",
      "page": null,
      "citation": "IT-kWh (electricity / PUE 1.2) x 0.12 L/kWh provider site WUE — cooling water drawn by our cloud provider's facility, attributed to us by billed IT load; we operate no data center. L → gal",
      "confidence": "low",
      "asof": null,
      "verified": false
    },
    "feed": "greenops"
  },
  {
    "subject": "platform:bosc",
    "subject_label": "Watermark / BOSC platform",
    "subject_kind": "platform",
    "predicate": "water_indirect",
    "value": 27.6,
    "unit": "gal",
    "status": "inference",
    "approximate": false,
    "low": 3.3,
    "high": 90.7,
    "evidence": {
      "source": null,
      "source_kind": "derived",
      "page": null,